{
  "schema": "s7-personal-surface-result/v1",
  "surface_id": "surface.model-policy",
  "canonical_source": {
    "path": "agent-workflows/manifests/model-policy.json",
    "digest": "sha256:eb7e45733239472c05158bc4611bb120a1fa60930a075ef08f6b0003c5060b50"
  },
  "acceptance": {
    "selector": "S7PersonalSurfaceTests.test_model_policy_surface",
    "command": "PYTHONPATH=agent-workflows/src python3 agent-workflows/tests/test_s7_personal_surfaces.py S7PersonalSurfaceTests.test_model_policy_surface -v",
    "result": "passed"
  },
  "claim_boundary": {
    "source_fixture_only": true,
    "live_apply": false,
    "build": false,
    "runtime_compatibility": "unverified"
  },
  "proof": {
    "receipt_schema": "effective-model-fixture-receipt/v1",
    "model": "gpt-5.6-luna",
    "reasoning_effort": "max",
    "automatic_fallback": false,
    "config_apply": "explicit-user-command-only",
    "unsupported_value_action": "stop-without-substitution",
    "runtime_compatibility": "unverified"
  }
}
