{
  "schema": "s7-personal-surface-result/v1",
  "surface_id": "surface.config-installer-guardrail",
  "canonical_source": {
    "path": "agent-workflows/config-installer.py",
    "digest": "sha256:e3b06c6768755654d119d8c60d17ac96ed3f005bb84d47be033064f42c3a9f17"
  },
  "acceptance": {
    "selector": "S7PersonalSurfaceTests.test_config_installer_surface",
    "command": "PYTHONPATH=agent-workflows/src python3 agent-workflows/tests/test_s7_personal_surfaces.py S7PersonalSurfaceTests.test_config_installer_surface -v",
    "result": "passed"
  },
  "claim_boundary": {
    "source_fixture_only": true,
    "live_apply": false,
    "build": false,
    "runtime_compatibility": "unverified"
  },
  "proof": {
    "managed_keys": [
      "model",
      "model_reasoning_effort"
    ],
    "temporary_paths_only": true,
    "actual_user_config_accessed": false,
    "unknown_app_owned_bytes_preserved": true,
    "output_redacted": true,
    "secret_output": false,
    "backup": "verified-fixture",
    "doctor": "verified-fixture",
    "rollback": "verified-fixture",
    "refusals": [
      "concurrent-change",
      "stale-identity",
      "symlink"
    ]
  }
}
